{
  "schemaVersion": "1.0",
  "health": {
    "status": "healthy",
    "lastSuccessfulAt": "2026-10-27T13:16:12.963Z",
    "lastAttemptAt": "2026-10-27T13:16:12.963Z",
    "consecutiveFailures": 0
  },
  "source": {
    "url": "https://models.dev/api.json",
    "retrievedAt": "2026-10-23T06:32:15.246Z",
    "contentHash": "sha256:9a9b0d14a11351b7c3426d83696802fe4cd3349168da3bff110fd7b01be99601"
  },
  "models": [
    {
      "provider": "longcat",
      "model": "LongCat-2.0",
      "referenceProvider": "longcat",
      "referenceModel": "LongCat-2.0",
      "referenceUrl": "https://models.dev/models/meituan/longcat-2.0/",
      "status": "mismatch",
      "checks": [
        {
          "field": "createdAt",
          "official": "2026-03-12",
          "reference": "2026-06-30",
          "status": "mismatch"
        },
        {
          "field": "limits.contextTokens",
          "official": 1048576,
          "reference": 1048576,
          "status": "match"
        },
        {
          "field": "limits.maxOutputTokens",
          "official": 131072,
          "reference": 131072,
          "status": "match"
        },
        {
          "field": "capabilities.thinking",
          "official": true,
          "reference": true,
          "status": "match"
        },
        {
          "field": "capabilities.toolCalls",
          "official": true,
          "reference": true,
          "status": "match"
        },
        {
          "field": "capabilities.inputModalities",
          "official": [
            "text"
          ],
          "reference": [
            "text"
          ],
          "status": "match"
        },
        {
          "field": "capabilities.outputModalities",
          "official": [
            "text"
          ],
          "reference": [
            "text"
          ],
          "status": "match"
        },
        {
          "field": "prices.USD.input.standard",
          "official": 0.75,
          "reference": 0.3,
          "status": "mismatch"
        },
        {
          "field": "prices.USD.input.cacheHit",
          "official": 0.015,
          "reference": 0.006,
          "status": "mismatch"
        },
        {
          "field": "prices.USD.output",
          "official": 2.95,
          "reference": 1.2,
          "status": "mismatch"
        }
      ]
    },
    {
      "provider": "moonshot-cn",
      "model": "kimi-k3",
      "referenceProvider": "moonshotai",
      "referenceModel": "kimi-k3",
      "referenceUrl": "https://models.dev/models/moonshotai/kimi-k3/",
      "status": "partial",
      "checks": [
        {
          "field": "createdAt",
          "official": null,
          "reference": "2026-07-16",
          "status": "missing"
        },
        {
          "field": "limits.contextTokens",
          "official": 1048576,
          "reference": 1048576,
          "status": "match"
        },
        {
          "field": "limits.maxOutputTokens",
          "official": 1048576,
          "reference": 1048576,
          "status": "match"
        },
        {
          "field": "capabilities.thinking",
          "official": true,
          "reference": true,
          "status": "match"
        },
        {
          "field": "capabilities.toolCalls",
          "official": true,
          "reference": true,
          "status": "match"
        },
        {
          "field": "capabilities.inputModalities",
          "official": [
            "text",
            "image",
            "video"
          ],
          "reference": [
            "text",
            "image",
            "video"
          ],
          "status": "match"
        },
        {
          "field": "capabilities.outputModalities",
          "official": [
            "text"
          ],
          "reference": [
            "text"
          ],
          "status": "match"
        },
        {
          "field": "prices.USD.input.standard",
          "official": null,
          "reference": 3,
          "status": "missing"
        },
        {
          "field": "prices.USD.input.cacheHit",
          "official": null,
          "reference": 0.3,
          "status": "missing"
        },
        {
          "field": "prices.USD.output",
          "official": null,
          "reference": 15,
          "status": "missing"
        }
      ]
    },
    {
      "provider": "moonshot-cn",
      "model": "kimi-k2.7-code",
      "referenceProvider": "moonshotai",
      "referenceModel": "kimi-k2.7-code",
      "referenceUrl": "https://models.dev/models/moonshotai/kimi-k2.7-code/",
      "status": "partial",
      "checks": [
        {
          "field": "createdAt",
          "official": null,
          "reference": "2026-06-12",
          "status": "missing"
        },
        {
          "field": "limits.contextTokens",
          "official": 262144,
          "reference": 262144,
          "status": "match"
        },
        {
          "field": "limits.maxOutputTokens",
          "official": null,
          "reference": 262144,
          "status": "missing"
        },
        {
          "field": "capabilities.thinking",
          "official": true,
          "reference": true,
          "status": "match"
        },
        {
          "field": "capabilities.toolCalls",
          "official": true,
          "reference": true,
          "status": "match"
        },
        {
          "field": "capabilities.inputModalities",
          "official": [
            "text",
            "image",
            "video"
          ],
          "reference": [
            "text",
            "image",
            "video"
          ],
          "status": "match"
        },
        {
          "field": "capabilities.outputModalities",
          "official": [
            "text"
          ],
          "reference": [
            "text"
          ],
          "status": "match"
        },
        {
          "field": "prices.USD.input.standard",
          "official": null,
          "reference": 0.95,
          "status": "missing"
        },
        {
          "field": "prices.USD.input.cacheHit",
          "official": null,
          "reference": 0.19,
          "status": "missing"
        },
        {
          "field": "prices.USD.output",
          "official": null,
          "reference": 4,
          "status": "missing"
        }
      ]
    },
    {
      "provider": "moonshot-cn",
      "model": "kimi-k2.7-code-highspeed",
      "referenceProvider": "moonshotai",
      "referenceModel": "kimi-k2.7-code-highspeed",
      "referenceUrl": "https://models.dev/models/moonshotai/kimi-k2.7-code-highspeed/",
      "status": "partial",
      "checks": [
        {
          "field": "createdAt",
          "official": null,
          "reference": "2026-06-12",
          "status": "missing"
        },
        {
          "field": "limits.contextTokens",
          "official": 262144,
          "reference": 262144,
          "status": "match"
        },
        {
          "field": "limits.maxOutputTokens",
          "official": null,
          "reference": 262144,
          "status": "missing"
        },
        {
          "field": "capabilities.thinking",
          "official": true,
          "reference": true,
          "status": "match"
        },
        {
          "field": "capabilities.toolCalls",
          "official": true,
          "reference": true,
          "status": "match"
        },
        {
          "field": "capabilities.inputModalities",
          "official": [
            "text",
            "image",
            "video"
          ],
          "reference": [
            "text",
            "image",
            "video"
          ],
          "status": "match"
        },
        {
          "field": "capabilities.outputModalities",
          "official": [
            "text"
          ],
          "reference": [
            "text"
          ],
          "status": "match"
        },
        {
          "field": "prices.USD.input.standard",
          "official": null,
          "reference": 1.9,
          "status": "missing"
        },
        {
          "field": "prices.USD.input.cacheHit",
          "official": null,
          "reference": 0.38,
          "status": "missing"
        },
        {
          "field": "prices.USD.output",
          "official": null,
          "reference": 8,
          "status": "missing"
        }
      ]
    },
    {
      "provider": "moonshot-cn",
      "model": "kimi-k2.6",
      "referenceProvider": "moonshotai",
      "referenceModel": "kimi-k2.6",
      "referenceUrl": "https://models.dev/models/moonshotai/kimi-k2.6/",
      "status": "partial",
      "checks": [
        {
          "field": "createdAt",
          "official": null,
          "reference": "2026-04-20",
          "status": "missing"
        },
        {
          "field": "limits.contextTokens",
          "official": 262144,
          "reference": 262144,
          "status": "match"
        },
        {
          "field": "limits.maxOutputTokens",
          "official": 262144,
          "reference": 262144,
          "status": "match"
        },
        {
          "field": "capabilities.thinking",
          "official": true,
          "reference": true,
          "status": "match"
        },
        {
          "field": "capabilities.toolCalls",
          "official": true,
          "reference": true,
          "status": "match"
        },
        {
          "field": "capabilities.inputModalities",
          "official": [
            "text",
            "image",
            "video"
          ],
          "reference": [
            "text",
            "image",
            "video"
          ],
          "status": "match"
        },
        {
          "field": "capabilities.outputModalities",
          "official": [
            "text"
          ],
          "reference": [
            "text"
          ],
          "status": "match"
        },
        {
          "field": "prices.USD.input.standard",